{
  "id": "al-eizariya-old-town",
  "kind": "heritage",
  "name": "نواة البلدة القديمة في العيزرية",
  "place": "العيزرية، محافظة القدس",
  "summary": "بيوت حجرية وأفنية وأزقة مأهولة تشكل طبقة من ذاكرة البلدة اليومية، وليست موقعًا معزولًا عن السكان.",
  "ownerOrSteward": "يحتاج إلى تحديد محلي بحسب كل مبنى أو زقاق؛ لا يُفترض وجود مالك واحد.",
  "rightsAndSensitivity": [
    "المجال مأهول وقد يتضمن ملكيات خاصة.",
    "التصوير أو تسجيل الأشخاص والواجهات يحتاج موافقة مناسبة.",
    "لا تُحوّل الحياة اليومية إلى خلفية لجولة أو إعلان."
  ],
  "accessNotes": [
    "حالة الممرات والازدحام والوقوف تحتاج معاينة في وقت محدد.",
    "لا توجد في السجل الحالي بيانات موثقة عن مسار مهيأ للكراسي المتحركة.",
    "تُعرض كنقطة فهم أولية لا كمسار زيارة جاهز."
  ],
  "facts": [
    "تصف مصادر السياحة الفلسطينية نواة البلدة القديمة ببيوت حجرية وأفنية وأزقة مترابطة.",
    "توجد عناصر عمرانية مثل القناطر ضمن طبقات البلدة، لكن جاهزية الاقتراب والتفسير تحتاج تحققًا محليًا."
  ],
  "unknowns": [
    "الجهة المحلية التي تراجع وصف كل مبنى.",
    "حدود المجال العام والخاص في المسار المقترح.",
    "حالة النظافة والإضاءة والسلامة ونقاط التوقف.",
    "إمكانية استقبال مجموعة أو تصويرها دون إزعاج السكان."
  ],
  "status": "needs_review",
  "source": {
    "kind": "official_page",
    "label": "هيئة السياحة الفلسطينية — بيت عنيا/العيزرية",
    "url": "https://www.travelpalestine.ps/en/Site/397/Bethany-or-Al-E'izariya",
    "accessedAt": "2026-09-26",
    "independence": "primary",
    "evidenceNote": "يثبت الوصف العام للبلدة، ولا يثبت جاهزية مسار سياحي أو حالة تشغيلية راهنة."
  },
  "lastReviewed": "2026-09-26",
  "reviewDue": "2026-10-03"
}
